{
  "schemaVersion": 1,
  "generatedBy": "bun run ui:public-api:generate",
  "contracts": {
    "routing": "@makinbakin/sdk/routing owns server HTTP declarations; @makinbakin/sdk/navigation owns browser links, URL state, history, and dirty-exit behavior.",
    "stylesheet": "@makinbakin/sdk/styles.css",
    "privateImplementation": "@bakin/ui"
  },
  "summary": {
    "entrypoints": 7,
    "supportedEntrypoints": 7,
    "frozenLegacyEntrypoints": 0,
    "valueExports": 320,
    "typeExports": 435
  },
  "entrypoints": [
    {
      "specifier": "@makinbakin/sdk/ui",
      "sourcePath": "packages/sdk/src/ui/index.ts",
      "domain": "ui",
      "purpose": "Base actions, surfaces, form controls, overlays, states, and semantic style helpers.",
      "status": "supported-prerelease",
      "newConsumerPolicy": "supported",
      "values": [
        "Alert",
        "AlertAction",
        "AlertDescription",
        "AlertTitle",
        "alertVariants",
        "Avatar",
        "AvatarBadge",
        "AvatarFallback",
        "AvatarGroup",
        "AvatarGroupCount",
        "AvatarImage",
        "Badge",
        "badgeVariants",
        "Banner",
        "Button",
        "buttonVariants",
        "Card",
        "CardAction",
        "CardContent",
        "CardDescription",
        "CardFooter",
        "CardHeader",
        "CardMedia",
        "CardTitle",
        "Checkbox",
        "Collapsible",
        "CollapsibleContent",
        "CollapsibleTrigger",
        "Combobox",
        "ComboboxChip",
        "ComboboxChipRemove",
        "ComboboxChips",
        "ComboboxClear",
        "ComboboxContent",
        "ComboboxControl",
        "ComboboxEmpty",
        "ComboboxGroup",
        "ComboboxInput",
        "ComboboxItem",
        "ComboboxLabel",
        "ComboboxList",
        "ComboboxStatus",
        "ComboboxTrigger",
        "ComboboxValue",
        "Command",
        "CommandDialog",
        "CommandEmpty",
        "CommandGroup",
        "CommandInput",
        "CommandItem",
        "CommandList",
        "CommandSeparator",
        "CommandShortcut",
        "Dialog",
        "DialogClose",
        "DialogContent",
        "DialogDescription",
        "DialogFooter",
        "DialogHeader",
        "DialogOverlay",
        "DialogPortal",
        "DialogTitle",
        "DialogTrigger",
        "Drawer",
        "DrawerSection",
        "DropdownMenu",
        "DropdownMenuCheckboxItem",
        "DropdownMenuContent",
        "DropdownMenuGroup",
        "DropdownMenuItem",
        "DropdownMenuLabel",
        "DropdownMenuPortal",
        "DropdownMenuRadioGroup",
        "DropdownMenuRadioItem",
        "DropdownMenuSeparator",
        "DropdownMenuShortcut",
        "DropdownMenuSub",
        "DropdownMenuSubContent",
        "DropdownMenuSubTrigger",
        "DropdownMenuSwitchItem",
        "DropdownMenuTrigger",
        "Field",
        "FieldControl",
        "FieldDescription",
        "FieldError",
        "FieldGroup",
        "FieldLabel",
        "Fieldset",
        "FieldsetDescription",
        "FieldsetLegend",
        "FileInput",
        "Form",
        "FormActions",
        "Input",
        "InputGroup",
        "InputGroupAddon",
        "InputGroupButton",
        "InputGroupInput",
        "InputGroupText",
        "InputGroupTextarea",
        "Label",
        "Overline",
        "Popover",
        "PopoverContent",
        "PopoverDescription",
        "PopoverHeader",
        "PopoverPortal",
        "PopoverTitle",
        "PopoverTrigger",
        "Progress",
        "ProgressIndicator",
        "ProgressLabel",
        "ProgressTrack",
        "ProgressValue",
        "Radio",
        "RadioGroup",
        "Select",
        "SelectContent",
        "SelectGroup",
        "SelectItem",
        "SelectLabel",
        "SelectScrollDownButton",
        "SelectScrollUpButton",
        "SelectSeparator",
        "SelectTrigger",
        "SelectValue",
        "Separator",
        "Sheet",
        "SheetClose",
        "SheetContent",
        "SheetDescription",
        "SheetFooter",
        "SheetHeader",
        "SheetOverlay",
        "SheetPortal",
        "SheetTitle",
        "SheetTrigger",
        "ShimmerText",
        "Skeleton",
        "Spinner",
        "SubmitButton",
        "Switch",
        "SystemState",
        "systemStateDefaults",
        "Table",
        "TableBody",
        "TableCaption",
        "TableCell",
        "TableFooter",
        "TableHead",
        "TableHeader",
        "TableRow",
        "Tabs",
        "TabsContent",
        "TabsList",
        "tabsListVariants",
        "TabsTrigger",
        "Text",
        "Textarea",
        "Toast",
        "ToastAction",
        "ToastRegion",
        "Tooltip",
        "TooltipContent",
        "TooltipPortal",
        "TooltipProvider",
        "TooltipTrigger"
      ],
      "types": [
        "AlertProps",
        "AlertTone",
        "AlertVariantOptions",
        "AvatarProps",
        "AvatarSize",
        "BadgeProps",
        "BadgeSize",
        "BadgeTone",
        "BadgeVariant",
        "BadgeVariantOptions",
        "BannerProps",
        "BannerTone",
        "ButtonProps",
        "ButtonSize",
        "ButtonVariant",
        "ButtonVariantOptions",
        "CardFooterVariant",
        "CardInteractive",
        "CardOrientation",
        "CardProps",
        "CardSize",
        "CardTone",
        "CheckboxProps",
        "CollapsibleContentProps",
        "CollapsibleProps",
        "CollapsibleTriggerProps",
        "ComboboxChipProps",
        "ComboboxChipRemoveProps",
        "ComboboxChipsProps",
        "ComboboxClearProps",
        "ComboboxContentProps",
        "ComboboxControlProps",
        "ComboboxEmptyProps",
        "ComboboxGroupProps",
        "ComboboxInputProps",
        "ComboboxItemProps",
        "ComboboxLabelProps",
        "ComboboxListProps",
        "ComboboxProps",
        "ComboboxStatusProps",
        "ComboboxTriggerProps",
        "ComboboxValueProps",
        "CommandDialogProps",
        "CommandEmptyProps",
        "CommandGroupProps",
        "CommandInputProps",
        "CommandItemProps",
        "CommandListProps",
        "CommandProps",
        "CommandSeparatorProps",
        "CommandShortcutProps",
        "ControlSize",
        "ControlVariant",
        "DialogCloseProps",
        "DialogContentProps",
        "DialogDescriptionProps",
        "DialogFooterProps",
        "DialogHeaderProps",
        "DialogOverlayProps",
        "DialogPortalProps",
        "DialogProps",
        "DialogTitleProps",
        "DialogTriggerProps",
        "DrawerProps",
        "DrawerSectionHeadingLevel",
        "DrawerSectionProps",
        "DropdownMenuCheckboxItemProps",
        "DropdownMenuContentProps",
        "DropdownMenuGroupProps",
        "DropdownMenuItemProps",
        "DropdownMenuItemVariant",
        "DropdownMenuLabelProps",
        "DropdownMenuPortalProps",
        "DropdownMenuProps",
        "DropdownMenuRadioGroupProps",
        "DropdownMenuRadioItemProps",
        "DropdownMenuSeparatorProps",
        "DropdownMenuShortcutProps",
        "DropdownMenuSubContentProps",
        "DropdownMenuSubProps",
        "DropdownMenuSubTriggerProps",
        "DropdownMenuTriggerProps",
        "FeedbackAnnouncement",
        "FieldControlProps",
        "FieldDescriptionProps",
        "FieldErrorProps",
        "FieldGroupProps",
        "FieldLabelProps",
        "FieldOrientation",
        "FieldProps",
        "FieldRequirement",
        "FieldsetDescriptionProps",
        "FieldsetLegendProps",
        "FieldsetProps",
        "FileInputHandle",
        "FileInputProps",
        "FormActionsAlign",
        "FormActionsProps",
        "FormProps",
        "InputGroupAddonAlign",
        "InputGroupAddonProps",
        "InputGroupButtonProps",
        "InputGroupButtonSize",
        "InputGroupInputProps",
        "InputGroupProps",
        "InputGroupTextareaProps",
        "InputGroupTextProps",
        "InputProps",
        "InteractiveAction",
        "LabelProps",
        "LegacyAlertVariant",
        "LegacyAvatarSize",
        "LegacyBadgeVariant",
        "LegacyButtonSize",
        "LegacyButtonVariant",
        "LegacyCardSize",
        "OverlineProps",
        "PopoverContentProps",
        "PopoverDescriptionProps",
        "PopoverHeaderProps",
        "PopoverPortalProps",
        "PopoverProps",
        "PopoverTitleProps",
        "PopoverTriggerProps",
        "ProgressIndicatorProps",
        "ProgressMarker",
        "ProgressProps",
        "ProgressSize",
        "ProgressTone",
        "ProgressTrackMarker",
        "ProgressTrackProps",
        "RadioGroupProps",
        "RadioProps",
        "SelectContentProps",
        "SelectGroupProps",
        "SelectItemProps",
        "SelectLabelProps",
        "SelectProps",
        "SelectScrollDownButtonProps",
        "SelectScrollUpButtonProps",
        "SelectSeparatorProps",
        "SelectTriggerProps",
        "SelectTriggerSize",
        "SelectValueProps",
        "SeparatorProps",
        "SheetCloseProps",
        "SheetContentProps",
        "SheetDescriptionProps",
        "SheetFooterProps",
        "SheetHeaderProps",
        "SheetOverlayProps",
        "SheetPortalProps",
        "SheetProps",
        "SheetSide",
        "SheetTitleProps",
        "SheetTriggerProps",
        "ShimmerTextBase",
        "ShimmerTextHighlight",
        "ShimmerTextProps",
        "SkeletonProps",
        "SkeletonShape",
        "SpinnerProps",
        "SpinnerSize",
        "SubmitButtonProps",
        "SwitchProps",
        "SwitchSize",
        "SystemStateAlign",
        "SystemStateContent",
        "SystemStateHeadingLevel",
        "SystemStateKind",
        "SystemStateProps",
        "SystemStateScope",
        "TextareaProps",
        "TextProps",
        "TextSize",
        "TextTone",
        "TextWeight",
        "ToastActionProps",